{
  "as_of": "2026-07-02T21:00:00+00:00",
  "crypto": [
    {
      "category": "crypto_close",
      "expected_max": 1000000.0,
      "expected_min": 0.0,
      "importance": 65,
      "market": "CRYPTO",
      "provider": "mock",
      "record_id": "MOCK-BTC-20260702",
      "reference": "provider://mock/BTC-USD/2026-07-02",
      "reliability": 60,
      "source": "archived_replay_fixture",
      "symbol": "BTC-USD",
      "timestamp": "2026-07-02T20:16:00+00:00",
      "unit": "usd",
      "value": 108420.0
    }
  ],
  "global": [
    {
      "category": "global_risk_context",
      "expected_max": null,
      "expected_min": null,
      "importance": 70,
      "market": "GLOBAL",
      "provider": "mock",
      "record_id": "MOCK-GLOBAL-RISK-20260702",
      "reference": "provider://mock/global-risk/2026-07-02",
      "reliability": 60,
      "source": "archived_replay_fixture",
      "symbol": "GLOBAL",
      "timestamp": "2026-07-02T20:15:00+00:00",
      "unit": "state",
      "value": "neutral_positive"
    },
    {
      "category": "company_capex_context",
      "expected_max": null,
      "expected_min": null,
      "importance": 75,
      "market": "GLOBAL",
      "provider": "news",
      "record_id": "NEWS-AI-CAPEX-20260702",
      "reference": "provider://news/ai-capex/2026-07-02",
      "reliability": 70,
      "source": "archived_replay_fixture",
      "symbol": "AI-INFRA",
      "timestamp": "2026-07-02T18:30:00+00:00",
      "unit": "text",
      "value": "Archived provider context: AI infrastructure capital expenditure remained the active narrative."
    }
  ],
  "macro": [
    {
      "category": "currency_index",
      "expected_max": 150.0,
      "expected_min": 50.0,
      "importance": 80,
      "market": "MACRO",
      "provider": "macro",
      "record_id": "MACRO-DXY-20260702",
      "reference": "provider://macro/DXY/2026-07-02",
      "reliability": 93,
      "source": "archived_replay_fixture",
      "symbol": "DXY",
      "timestamp": "2026-07-02T20:06:00+00:00",
      "unit": "index",
      "value": 98.7
    },
    {
      "category": "bond_yield",
      "expected_max": 20.0,
      "expected_min": 0.0,
      "importance": 88,
      "market": "MACRO",
      "provider": "macro",
      "record_id": "MACRO-US10Y-20260702",
      "reference": "provider://macro/US10Y/2026-07-02",
      "reliability": 95,
      "source": "archived_replay_fixture",
      "symbol": "US10Y",
      "timestamp": "2026-07-02T20:05:00+00:00",
      "unit": "percent",
      "value": 4.24
    }
  ],
  "model_impact": "provider_data_only_not_production",
  "production_authorized": false,
  "provider_summary": {
    "etf": 1,
    "macro": 2,
    "mock": 2,
    "news": 1,
    "taiwan": 2,
    "us": 2
  },
  "quality": {
    "duplicate": 0,
    "invalid": 0,
    "missing": 0,
    "outlier": 0,
    "status": "PASS",
    "timestamp_errors": 0
  },
  "record_count": 10,
  "repository_write_authorized": false,
  "runtime_api_access": false,
  "snapshot_date": "2026-07-02",
  "snapshot_id": "MARKET-SNAPSHOT-20260702",
  "status": "validated_shadow_snapshot",
  "taiwan": [
    {
      "category": "theme_turnover",
      "expected_max": 1000.0,
      "expected_min": 0.0,
      "importance": 82,
      "market": "TAIWAN",
      "provider": "taiwan",
      "record_id": "TW-AI-TURNOVER-20260702",
      "reference": "provider://taiwan/theme/ai-supply-chain/2026-07-02",
      "reliability": 88,
      "source": "archived_replay_fixture",
      "symbol": "AI-SUPPLY-CHAIN",
      "timestamp": "2026-07-02T05:31:00+00:00",
      "unit": "billion_twd",
      "value": 168.4
    },
    {
      "category": "index_close",
      "expected_max": 40000.0,
      "expected_min": 10000.0,
      "importance": 90,
      "market": "TAIWAN",
      "provider": "taiwan",
      "record_id": "TW-TAIEX-20260702",
      "reference": "provider://taiwan/TAIEX/2026-07-02",
      "reliability": 95,
      "source": "archived_replay_fixture",
      "symbol": "TAIEX",
      "timestamp": "2026-07-02T05:30:00+00:00",
      "unit": "points",
      "value": 23540.2
    }
  ],
  "us": [
    {
      "category": "etf_flow",
      "expected_max": 5000.0,
      "expected_min": -5000.0,
      "importance": 78,
      "market": "US",
      "provider": "etf",
      "record_id": "ETF-SMH-FLOW-20260702",
      "reference": "provider://etf/SMH/flow/2026-07-02",
      "reliability": 86,
      "source": "archived_replay_fixture",
      "symbol": "SMH",
      "timestamp": "2026-07-02T20:10:00+00:00",
      "unit": "million_usd",
      "value": 184.0
    },
    {
      "category": "semiconductor_index",
      "expected_max": 10000.0,
      "expected_min": 500.0,
      "importance": 94,
      "market": "US",
      "provider": "us",
      "record_id": "US-SOX-20260702",
      "reference": "provider://us/SOX/2026-07-02",
      "reliability": 94,
      "source": "archived_replay_fixture",
      "symbol": "SOX",
      "timestamp": "2026-07-02T20:01:00+00:00",
      "unit": "points",
      "value": 5688.1
    },
    {
      "category": "index_close",
      "expected_max": 10000.0,
      "expected_min": 1000.0,
      "importance": 92,
      "market": "US",
      "provider": "us",
      "record_id": "US-SPX-20260702",
      "reference": "provider://us/SPX/2026-07-02",
      "reliability": 96,
      "source": "archived_replay_fixture",
      "symbol": "SPX",
      "timestamp": "2026-07-02T20:00:00+00:00",
      "unit": "points",
      "value": 6320.4
    }
  ]
}
